project	revision	source_identity	operation	observable_contract	reference_representation	live_state	owner_traffic	provenance	failure_cleanup	fact_behavior	c_route	c0_dependency	reference_events	forced_delta	evidence_state	falsifier	evidence_reference
hashbrown	c62a63a61b7caf2de8f9ecb7b06a66b0ab6bdf3d	src/raw.rs@0c8ad353ba95817e72b0a8fea48fa2599099ea3def374f254ab6402a9c468d22	lookup	A matching occupied bucket is returned or search stops at an EMPTY control byte.	Separate payload array plus replicated control-byte tail; FULL carries a seven-bit hash tag.	Only a FULL control byte authorizes equality access to its corresponding payload.	No payload owner moves; hash and equality callbacks consume only borrowed inputs.	The returned bucket and any derived reference must remain tied to the same table root and mutation version.	Callback abort ends the operation; table representation and owners remain unchanged.	Group matches are candidates; equality confirms a hit; EMPTY terminates the probe; mutation invalidates all such facts.	C-4 sparse lookup composed with C-7 returned-element provenance and C-11 occupancy/probe facts.	C0-10 portable group/SIMD load, match, and scalar fallback row is unenumerated.	Group loads, tag comparisons, equality only on matching FULL buckets, probe advance, and EMPTY termination; no allocation, payload move, or atomic event.	No structural tax is identified, but exact target-row semantics are absent.	C0-GAP	Enumerate one portable group row and show the existing probe performs no extra load, check, scan, or payload access.	src/raw.rs:557-580,660-685,1192-1208,2008-2044; src/control/mod.rs; src/control/tag.rs
hashbrown	c62a63a61b7caf2de8f9ecb7b06a66b0ab6bdf3d	src/raw.rs@0c8ad353ba95817e72b0a8fea48fa2599099ea3def374f254ab6402a9c468d22	lookup	A matching tag permits equality to inspect exactly the corresponding live payload.	Control metadata and payload reside in one allocation but in distinct regions.	The control-to-payload relation must prove the bucket live before forming a payload reference.	No owner traffic.	Equality and the returned bucket derive authority from the exact FULL slot, not from the hash or integer index.	Callback abort preserves all control bytes, counters, and payload owners.	The FULL observation needs a version-bounded occupancy fact synchronized with payload liveness.	C-4 plus C-7 and C-11 are the named families, but their exact cross-family admission rule is absent.	None.	One metadata observation gates one payload access; no initialization, copy, allocation, indirection, scan beyond probing, atomic, or machine event is added.	No forced structural delta is identified; authority is unresolved.	COMPOSITION-GAP	Define a finite same-root same-version control-to-payload rule that rejects EMPTY and DELETED without recognizing Hashbrown.	src/raw.rs:2008-2044
hashbrown	c62a63a61b7caf2de8f9ecb7b06a66b0ab6bdf3d	src/raw.rs@0c8ad353ba95817e72b0a8fea48fa2599099ea3def374f254ab6402a9c468d22	lookup	An EMPTY byte proves the searched key is absent along the current probe sequence.	Replicated control tail permits unaligned group reads across the logical end.	No payload becomes live or dead.	No owner traffic.	The miss result is tied to the table root, capacity, probe position, and mutation version.	Callback abort or ordinary miss leaves the table unchanged.	EMPTY termination must be a closed probe fact and must be invalidated by insertion, removal, or rehash.	C-4 sparse search composed with C-11 probe facts; exact fact schema is absent.	None.	Existing group probe and EMPTY test only; no whole-table scan or payload traffic.	No forced structural delta is identified; the fact producer and invalidators are unspecified.	COMPOSITION-GAP	Enumerate the probe-termination fact and show every mutation that can change reachability invalidates it.	src/raw.rs:2008-2044
hashbrown	c62a63a61b7caf2de8f9ecb7b06a66b0ab6bdf3d	src/raw.rs@0c8ad353ba95817e72b0a8fea48fa2599099ea3def374f254ab6402a9c468d22	vacant insertion	Search returns a vacant index that remains usable only until table mutation.	An EMPTY or DELETED control slot corresponds to uninitialized payload storage.	The selected payload place remains vacant until the insertion commit.	The offered key and value remain owned by the caller-side operation until committed.	The vacant index needs a same-root version token; an integer index alone grants no access.	Hash or equality abort preserves the original table and returns or destroys offered owners according to the call boundary.	The vacancy fact is invalidated by any intervening mutation, resize, or rehash.	C-4 vacant-entry protocol composed with C-7 entry provenance and C-11 vacancy facts.	None.	Probe and vacancy selection only; no payload initialization, copy, allocation, or atomic event.	No forced structural delta is identified; the versioned entry token is unspecified.	COMPOSITION-GAP	Define a non-escapable vacant token that cannot be reused after mutation and adds no runtime metadata.	src/raw.rs:1120-1144,1795-1842
hashbrown	c62a63a61b7caf2de8f9ecb7b06a66b0ab6bdf3d	src/raw.rs@0c8ad353ba95817e72b0a8fea48fa2599099ea3def374f254ab6402a9c468d22	vacant insertion	Without growth, one vacant slot becomes FULL and receives exactly one key-value owner pair.	Control byte is written with the hash tag and the uninitialized payload place is then written.	The transition must prevent access in the interval between metadata commit and payload write and finish with exactly one live payload.	Each offered owner moves exactly once into the selected place; no previous payload owner exists.	The resulting mutable value borrow derives from the newly live slot and table root.	No recoverable failure occurs after slot preparation in the reference path; abandonment must either precede commit or perform fixed rollback/cleanup.	Control, items, growth_left, payload liveness, and all vacancy/probe facts change in one logical transition.	C-4 sparse insertion needs a fixed C-6 transition and C-7 result rule; the exact state machine is absent.	None.	One control update, one payload write, items increment, and growth_left decrement only for EMPTY; no zeroing or payload copy.	No forced tax is identified; exact sequencing, abandonment, and fact synchronization are unresolved.	COMPOSITION-GAP	Enumerate a checked commit protocol matching the reference writes without a temporary tag, rollback scan, or extra payload move.	src/raw.rs:1153-1187,1907-1919,2458-2464
hashbrown	c62a63a61b7caf2de8f9ecb7b06a66b0ab6bdf3d	src/map.rs@b79497ce537ffc5ed4f8f3399434b9216c01e7927fdc434fee190e9e9ce2abb0	vacant insertion	VacantEntry insertion returns a mutable reference to the inserted value.	The entry stores the key, table reference, hash, and vacant index; payload remains in the table allocation.	The selected slot changes from vacant to live exactly once.	The stored key and supplied value move into the table; the returned reference owns nothing.	The result must derive from the inserted value field through the table root, not from the temporary entry object.	If insertion cannot commit, both offered owners require exact return or destruction; successful entry consumption needs no later cleanup.	Successful insertion invalidates the vacant token and produces a version-bounded live-value fact.	C-4 plus C-6 insertion composed with C-7 entry-result provenance; exact composition is absent.	None.	No extra allocation or indirection beyond the reference table; one key-value write and one returned borrow.	No forced structural delta is identified; result provenance and invalidation are unspecified.	COMPOSITION-GAP	Define the result-source map and show consuming the entry cannot leave an alias or cleanup obligation.	src/map.rs:2827-2831,4162-4260
hashbrown	c62a63a61b7caf2de8f9ecb7b06a66b0ab6bdf3d	src/raw.rs@0c8ad353ba95817e72b0a8fea48fa2599099ea3def374f254ab6402a9c468d22	vacant insertion	When growth is required, insertion acquires a larger root and then commits the item.	A new allocation contains payload storage, control bytes, and the replicated control tail.	Existing live slots remain authoritative until resize commit; the new selected slot becomes live after migration.	Existing owners relocate; the offered pair moves once into its final vacant slot.	All resulting access must re-root to the new allocation and invalidate old-root entries.	Allocation failure must leave the old table and offered owners in their declared states.	All old-root occupancy and probe facts invalidate at resize commit.	C-4/C-6 route the table protocol, but physical-root acquisition requires an exact C0 row.	C0-7 growth allocation, alignment, layout, failure, and transfer row is unenumerated.	One reference growth allocation plus reference relocation and release; no zeroing requirement is observed.	No extra allocation is identified; the exact permitted allocation event and failure contract are absent.	C0-GAP	Enumerate the selected allocation row and show failure preserves owners while success adds no second root event or zero fill.	src/raw.rs:1024-1046,2682-2712,2739-2792,2885-2957
hashbrown	c62a63a61b7caf2de8f9ecb7b06a66b0ab6bdf3d	src/map.rs@b79497ce537ffc5ed4f8f3399434b9216c01e7927fdc434fee190e9e9ce2abb0	replacement	Inserting an existing key retains the stored key, replaces the stored value, returns the old value, and consumes the offered key.	The existing FULL slot remains occupied with the same key and a new value.	Occupancy is continuous while the value owner changes.	New value moves once into the slot; old value moves once to the result; offered duplicate key is destroyed once.	The returned old value is owned; any mutable reference to the new value derives from the same live slot and new mutation version.	Equality abort leaves both table owners unchanged; after match, replacement requires exact disposition for all three owners.	Occupancy may remain valid, but value-content and borrow facts invalidate at replacement.	C-4 replacement needs a fixed C-6 owner-disposition transition and C-11 selective invalidators; it is unenumerated.	None.	One value replacement and one old-value return; no key replacement, allocation, zeroing, scan, or atomic event.	No forced structural delta is identified; exact owner and fact transition is absent.	COMPOSITION-GAP	Enumerate replacement so the stored key is never moved and each offered or displaced owner has one disposition.	src/map.rs:1806-1821,4045-4051
hashbrown	c62a63a61b7caf2de8f9ecb7b06a66b0ab6bdf3d	src/raw.rs@0c8ad353ba95817e72b0a8fea48fa2599099ea3def374f254ab6402a9c468d22	replacement	A replace-with callback may restore a replacement item or remove the slot after temporarily taking the owner.	One FULL slot is logically in transition; control may be restored or changed to vacant.	The original item is live in the callback input, not simultaneously in the slot.	Original owner moves to the callback; returned Some owner moves back, while None leaves the slot vacant.	No reference to the temporarily vacant payload may escape; returned entry provenance depends on the branch.	Callback abort and both normal branches require exact cleanup and a declared valid table state.	All payload and occupancy facts invalidate during the transition; the Some branch may produce fresh FULL facts.	C-4 needs one fixed C-6 replace/remove state machine and C-7 branch-result provenance; none is enumerated.	None.	At most one owner take and one owner restore; no allocation, zeroing, or unrelated metadata.	No forced structural delta is identified; callback-abort cleanup is unresolved.	COMPOSITION-GAP	Define the fixed two-branch protocol and its abort cleanup without copying the item or adding a persistent tag.	src/raw.rs:1091-1110; src/map.rs:4126-4153
hashbrown	c62a63a61b7caf2de8f9ecb7b06a66b0ab6bdf3d	src/raw.rs@0c8ad353ba95817e72b0a8fea48fa2599099ea3def374f254ab6402a9c468d22	removal	A found FULL slot becomes EMPTY or DELETED while its key-value owner is returned.	Control metadata preserves probe reachability after the payload becomes vacant.	The payload is read exactly once as an owner and is no longer live after removal.	The key-value owner moves once from the slot to the result; it is not destroyed in place.	The result is an owned value; the removal token must have been derived from the matching FULL slot.	A miss changes nothing; found removal has no recoverable failure after ownership transfer in the reference path.	The removed slot and affected probe facts invalidate; items decrements and growth_left may change.	C-4 removal requires an exact C-6 transition and C-11 invalidation rule; the state machine is absent.	None.	One owner read, one control update, items decrement; no allocation, zeroing, payload copy, or atomic event.	No forced structural delta is identified; transition authority is unresolved.	COMPOSITION-GAP	Enumerate removal so metadata cannot authorize a payload after the owner read and the result is disposed exactly once.	src/raw.rs:770-797,817-823,3224-3288
hashbrown	c62a63a61b7caf2de8f9ecb7b06a66b0ab6bdf3d	src/raw.rs@0c8ad353ba95817e72b0a8fea48fa2599099ea3def374f254ab6402a9c468d22	removal	The control byte becomes DELETED when EMPTY would break an existing probe chain, otherwise EMPTY restores growth capacity.	A group-local emptiness test selects the tombstone state.	The removed payload remains vacant in either control state.	No additional owner traffic beyond the removed owner.	No payload provenance is derived from EMPTY or DELETED.	No separate failure path; the table must remain searchable under either branch.	DELETED preserves reachability; EMPTY permits growth_left increment; both invalidate the old FULL fact.	C-4 has the right sparse representation family, but its exact deletion/probe-maintenance relation with C-11 is absent.	C0-10 group operations are also implicated, but the primary missing authority is the composition rule.	Two group loads and control update as in the reference; no whole-table scan or persistent extra metadata.	No forced structural delta is identified; the branch proof and fact update are unspecified.	COMPOSITION-GAP	Define the finite EMPTY-versus-DELETED rule and show it preserves lookup without an extra scan or metadata bit.	src/raw.rs:3224-3288
hashbrown	c62a63a61b7caf2de8f9ecb7b06a66b0ab6bdf3d	src/map.rs@b79497ce537ffc5ed4f8f3399434b9216c01e7927fdc434fee190e9e9ce2abb0	removal	Removing an occupied entry returns the exact stored key and value pair and consumes the entry guard.	The guard identifies one FULL table slot.	The slot becomes vacant and cannot be accessed through the consumed guard.	Both stored owners move once to the result.	The guard-to-slot relation must be same-root and version-bounded; the result is owned.	Guard consumption closes all cleanup; a miss is represented before creating the occupied guard.	Mutation invalidates the guard and all slot borrows.	C-4 plus C-7 occupied-entry provenance and invalidation are named but not enumerated.	None.	No extra allocation, indirection, copy, zeroing, scan, or atomic event.	No forced structural delta is identified; guard consumption and invalidation are unspecified.	COMPOSITION-GAP	Define the occupied-entry source map and prove no reference derived from the guard survives removal.	src/map.rs:3881-3905
hashbrown	c62a63a61b7caf2de8f9ecb7b06a66b0ab6bdf3d	src/raw.rs@0c8ad353ba95817e72b0a8fea48fa2599099ea3def374f254ab6402a9c468d22	rehash	Reserve chooses in-place tombstone cleanup or resize according to capacity and growth state.	The existing root is reused for in-place rehash or replaced by one newly allocated root.	All live payloads remain accounted for across the selected branch.	No payload owner is duplicated; branch selection itself moves none.	All entry, bucket, and probe results are invalidated by either rehash branch.	Allocation failure is possible only on resize and must preserve the old table.	Branch selection invalidates old probe facts at the branch commit point.	C-4/C-6 need a closed branch and commit algebra; the exact rule is absent.	C0-7 is required only for the resize branch.	Reference conditional branch; no extra scan, allocation, or metadata beyond the chosen reference algorithm.	No forced structural delta is identified; branch-specific commit and failure behavior are unspecified.	COMPOSITION-GAP	Define one finite branch protocol that charges allocation only to resize and preserves all owners on allocation failure.	src/raw.rs:2739-2792
hashbrown	c62a63a61b7caf2de8f9ecb7b06a66b0ab6bdf3d	src/raw.rs@0c8ad353ba95817e72b0a8fea48fa2599099ea3def374f254ab6402a9c468d22	rehash	Resize allocates a new table, copies each FULL payload bitwise once to its destination, then swaps roots and frees old storage without dropping moved items.	Old and new sparse representations coexist until commit; only FULL slots are traversed as values.	Before commit old slots remain the semantic owners; after commit exactly the corresponding new slots are live.	Each live payload relocates once; old allocation release performs no payload destruction.	All results re-root to the new allocation; old-root provenance becomes invalid.	If hashing aborts, the guard frees new raw storage without dropping copied bytes and old owners remain live.	All old-root facts invalidate; new FULL and probe facts are produced only at successful commit.	C-4 resize composed with C-6 relocation/cleanup and C-7/C-11 re-rooting is not enumerated.	C0-7 exact allocation and release row is unenumerated.	One allocation, one hash per live item, one raw payload relocation per live item, one old-root release; no zero fill or second payload copy.	No extra structural event is identified; exact allocation and relocation authority are absent.	C0-GAP	Enumerate C0-7 and the relocation commit so generated structure requires exactly one allocation and one relocation per live item.	src/raw.rs:2682-2712,2885-2957
hashbrown	c62a63a61b7caf2de8f9ecb7b06a66b0ab6bdf3d	src/raw.rs@0c8ad353ba95817e72b0a8fea48fa2599099ea3def374f254ab6402a9c468d22	rehash	In-place rehash first maps every FULL control byte to DELETED while payload owners remain present.	One existing allocation is reused; DELETED temporarily denotes an unprocessed live payload, unlike ordinary vacant DELETED.	Every former FULL payload remains live but uses transition-specific authorization.	No owner moves in the marking pass.	Ordinary DELETED grants no payload access; only a non-escapable rehash protocol may authorize these transition places.	Abort requires the rehash guard to distinguish processed and unprocessed owners.	Ordinary occupancy facts invalidate; transition facts must not escape or be confused with normal DELETED state.	C-4 plus C-6 need a phase-specific sparse relation not enumerated by the frozen family.	None.	One control scan and tag rewrite per control byte as in the reference; no allocation, payload initialization, or atomic event.	No extra structural delta is identified; the phase-specific interpretation and cleanup are absent.	COMPOSITION-GAP	Define a closed rehash phase whose DELETED-live state is inaccessible to ordinary sparse operations and needs no persistent extra tag.	src/raw.rs:2984-3027
hashbrown	c62a63a61b7caf2de8f9ecb7b06a66b0ab6bdf3d	src/raw.rs@0c8ad353ba95817e72b0a8fea48fa2599099ea3def374f254ab6402a9c468d22	rehash	An in-place item either restores FULL in its probe group, moves to an EMPTY slot, or swaps through a DELETED chain until placed.	Transition-local DELETED slots hold unprocessed live owners; EMPTY slots are vacant.	Each iteration preserves exactly one displaced owner and one live copy of every other item.	Same-group restores without movement; EMPTY branch relocates once; DELETED branch swaps and continues with the displaced owner.	No intermediate bucket reference escapes; successful items receive fresh same-root occupancy facts.	Normal completion leaves only ordinary FULL, EMPTY, and permitted tombstone states.	Each branch consumes and produces explicit transition facts; final commit invalidates the rehash phase.	C-4/C-6 relocation and swap protocols plus C-11 facts are named but their exact composition is absent.	None.	Reference probe, optional raw move or swap, and control updates only; no allocation, zeroing, or extra metadata.	No forced structural delta is identified; loop invariant and exact-use token are unspecified.	COMPOSITION-GAP	Enumerate a finite invariant proving each live payload relocates at most once to its final place or participates in accounted swaps without duplication.	src/raw.rs:3028-3077
hashbrown	c62a63a61b7caf2de8f9ecb7b06a66b0ab6bdf3d	src/raw.rs@0c8ad353ba95817e72b0a8fea48fa2599099ea3def374f254ab6402a9c468d22	rehash	If the hash callback aborts during in-place rehash, the guard destroys every still-unprocessed live payload exactly once and leaves processed entries valid.	The same root contains a prefix-like processed set encoded by restored FULL and an unprocessed set encoded by transition-local DELETED.	Processed FULL payloads survive; each remaining transition-DELETED payload becomes dead after destruction.	Every unprocessed owner is destroyed once; processed owners remain in the table.	No result borrow survives abort; surviving table provenance is fresh for the partial state.	The documented partial-progress state loses the unprocessed contents but must remain destructible and searchable for survivors.	Abort invalidates all phase and pre-rehash facts; survivor facts must be re-established.	C-4/C-6 recoverable partial-progress cleanup and C-11 survivor facts are not enumerated.	None.	One cleanup scan plus one destruction per unprocessed item as in the reference guard; no allocation or owner duplication.	No forced structural delta is identified; exact partial-progress cleanup authority is absent.	COMPOSITION-GAP	Define the abort state and prove each DELETED-live payload is destroyed once while no restored FULL payload is destroyed.	src/raw.rs:2984-3027
hashbrown	c62a63a61b7caf2de8f9ecb7b06a66b0ab6bdf3d	src/raw.rs@0c8ad353ba95817e72b0a8fea48fa2599099ea3def374f254ab6402a9c468d22	rehash	Successful rehash publishes new occupancy, probe, and growth facts only after all live owners reach valid FULL slots.	Same-root in-place rehash changes versions; resize also changes the physical root.	Every live payload has exactly one final FULL slot.	No owner traffic occurs after the final placement except release of raw old storage on resize.	Old entries and references are invalid; new access derives from the final root and version.	No cleanup remains after successful commit.	Pre-rehash facts invalidate; final control/counter observations may produce only enumerated replacement facts.	C-4/C-7 need invalidation and C-11 needs sparse rehash fact schemas; neither is enumerated.	None beyond C0-7 for resize and C0-10 for group operations.	Logical commit only; no extra runtime field or event is inherent.	No forced structural delta is identified; closed fact schemas and invalidators are absent.	COMPOSITION-GAP	Enumerate final occupancy/probe/growth facts and demonstrate that no old-root or old-version fact can be consumed.	src/raw.rs:2739-2792,2885-2957,2984-3077
